[
  {
    "schemaVersion": "nomad-ai-job-fit-v1",
    "matchKey": "9d1e4f3e44a494a5762adfd1d91ca67cfeb07d8bc72f9b025f701548e2c87d0b",
    "evaluationKey": "2de865d80d6decfbc2fca1fb9d75ce6470c79bf0a5f4687f7860b78a39736e0d",
    "jobKey": "linkedin:4436371317",
    "candidateHash": "c61557c7acbb2b791ebe09cc74cd3d3d29344035853528bb77833f83e760f31c",
    "candidateSnapshotHash": "505e87a12cceb8cad1a7e7b2360d92b2ee1b339a30dd06234e7c699f071fe9b2",
    "evaluatedAt": "2026-09-05T16:55:35Z",
    "source": "linkedin",
    "externalId": "4436371317",
    "url": "https://www.linkedin.com/jobs/view/senior-software-engineer-java-at-clear-4436371317",
    "title": "Senior Software Engineer, Java",
    "company": "CLEAR",
    "location": "New York, NY",
    "postedAt": "2026-09-05",
    "fitScore": 78,
    "deliveryScore": 4,
    "recommendation": "strong",
    "evaluationStatus": "scored",
    "why": "Strong match for a senior full-stack software engineering role: eight years of backend/full-stack experience, React, TypeScript, AWS, Docker, Kubernetes, APIs, and CI/CD align well with the posting.",
    "gapSummary": "The posting highlights Java, which is not listed in the candidate’s skills. Work arrangement, New York logistics, and work authorization are not specified.",
    "blockingGates": [],
    "scoreAdjustedForGates": false,
    "gates": {
      "coreRole": {
        "status": "pass",
        "postingEvidence": "\"Senior Fullstack Software Engineers\" to build scalable full-stack applications.",
        "candidateEvidence": "Candidate is a Software Engineer with experience building backend and full-stack web services."
      },
      "mandatoryRequirements": {
        "status": "pass",
        "postingEvidence": "Requires 6+ years using technologies such as Java, React, and TypeScript, plus AWS, Docker, Kubernetes, GitHub, and CI/CD.",
        "candidateEvidence": "Eight years’ experience; lists React, TypeScript, AWS, Docker, Kubernetes, Git, and CI/CD. Java is not listed, but the posting says technologies such as."
      },
      "experienceSeniority": {
        "status": "pass",
        "postingEvidence": "Title is \"Senior Software Engineer, Java\" and posting requires \"6+ years\" of professional experience.",
        "candidateEvidence": "Candidate has eight years of experience and accepts mid and senior levels; no senior-role rejection is stated."
      },
      "workModeLocation": {
        "status": "unknown",
        "postingEvidence": "Posting lists New York, NY; work arrangement is not specified.",
        "candidateEvidence": "Candidate accepts remote, hybrid, and onsite work worldwide, but specific New York ability is not established."
      },
      "explicitPreferences": {
        "status": "pass",
        "postingEvidence": "Role targets Software Engineer and full-stack engineering work.",
        "candidateEvidence": "Target terms include Software Engineer, Backend Engineer, and Full Stack Engineer; no conflicting preference is stated."
      }
    },
    "staticDecision": {
      "schemaVersion": "nomad-scoring-v3-static-decision-v3",
      "action": "forward",
      "lane": "rank-forward",
      "rankScore": 52,
      "knownComparisons": 3,
      "unknownComparisons": 7,
      "unknownRescue": false,
      "reasons": [
        "static rank 52 meets forward threshold 30"
      ],
      "signals": [
        {
          "name": "content_validity",
          "status": "pass",
          "hard": true,
          "postingValue": "Senior Software Engineer, Java",
          "profileValue": null,
          "evidence": "no explicit invalidity",
          "source": "source-envelope",
          "similarity": null,
          "exactMatch": null
        },
        {
          "name": "work_arrangement",
          "status": "unknown",
          "hard": true,
          "postingValue": null,
          "profileValue": [
            "remote",
            "hybrid",
            "onsite"
          ],
          "evidence": "constraint is missing, empty, or not explicitly closed",
          "source": "data.employment.workArrangements",
          "similarity": null,
          "exactMatch": null
        },
        {
          "name": "physical_country",
          "status": "unknown",
          "hard": true,
          "postingValue": [
            {
              "raw": "New York, NY",
              "countryName": null,
              "countryCode": null,
              "city": null,
              "region": null
            }
          ],
          "profileValue": null,
          "evidence": "posting did not establish exclusively physical arrangements",
          "source": "data.employment.workArrangements",
          "similarity": null,
          "exactMatch": null
        },
        {
          "name": "required_language",
          "status": "unknown",
          "hard": true,
          "postingValue": null,
          "profileValue": [
            {
              "language": "English",
              "level": "B2",
              "evidence": "Example profile: professional working proficiency"
            }
          ],
          "evidence": "required language or complete candidate language set is missing",
          "source": "data.requirements.languages",
          "similarity": null,
          "exactMatch": null
        },
        {
          "name": "contract_type",
          "status": "unknown",
          "hard": true,
          "postingValue": null,
          "profileValue": [],
          "evidence": "posting or closed candidate contract set is missing",
          "source": "data.employment.contractTypes",
          "similarity": null,
          "exactMatch": null
        },
        {
          "name": "target_terms",
          "status": "match",
          "hard": false,
          "postingValue": [
            "Senior Software Engineer, Java"
          ],
          "profileValue": [
            "Software Engineer",
            "Backend Engineer",
            "Full Stack Engineer",
            "Platform Engineer"
          ],
          "evidence": "provider-free semantic approximation=0.667; shared tokens=['engineer', 'software']; exact whole terms=[]",
          "source": "data.title|data.classification|data.domains",
          "similarity": 0.6666666666666666,
          "exactMatch": false
        },
        {
          "name": "required_skills",
          "status": "unknown",
          "hard": false,
          "postingValue": null,
          "profileValue": [
            "Python",
            "TypeScript",
            "JavaScript",
            "React",
            "Node.js",
            "SQL",
            "PostgreSQL",
            "Docker",
            "Kubernetes",
            "AWS",
            "REST APIs",
            "Git",
            "CI/CD"
          ],
          "evidence": "one side is unknown",
          "source": "data.requirements.requiredSkills",
          "similarity": null,
          "exactMatch": null
        },
        {
          "name": "preferred_skills",
          "status": "unknown",
          "hard": false,
          "postingValue": null,
          "profileValue": [
            "Python",
            "TypeScript",
            "JavaScript",
            "React",
            "Node.js",
            "SQL",
            "PostgreSQL",
            "Docker",
            "Kubernetes",
            "AWS",
            "REST APIs",
            "Git",
            "CI/CD"
          ],
          "evidence": "one side is unknown",
          "source": "data.requirements.preferredSkills",
          "similarity": null,
          "exactMatch": null
        },
        {
          "name": "seniority",
          "status": "unknown",
          "hard": false,
          "postingValue": {
            "levels": null,
            "experience": null
          },
          "profileValue": {
            "levels": [
              "mid",
              "senior"
            ],
            "yearsExperience": 8
          },
          "evidence": "no comparable structured seniority or experience facts",
          "source": "data.seniority.levels|data.requirements.experience",
          "similarity": null,
          "exactMatch": null
        },
        {
          "name": "semantic_proxy",
          "status": "match",
          "hard": false,
          "postingValue": [
            "Senior Software Engineer, Java"
          ],
          "profileValue": [
            "Software Engineer",
            "Backend Engineer",
            "Full Stack Engineer",
            "Platform Engineer",
            "Python",
            "TypeScript",
            "JavaScript",
            "React",
            "Node.js",
            "SQL",
            "PostgreSQL",
            "Docker"
          ],
          "evidence": "provider-free semantic approximation=0.667; shared tokens=['engineer', 'software']; exact whole terms=[]",
          "source": "structured-target-skill-domain-proxy",
          "similarity": 0.6666666666666666,
          "exactMatch": false
        }
      ]
    },
    "scoring": {
      "algorithm": "scoring-v3",
      "actorJobSchema": "nomad-agent-job-v1",
      "profileSchema": "nomad-scoring-v3-profile-v2",
      "staticDecisionSchema": "nomad-scoring-v3-static-decision-v3",
      "verdictSchema": "nomad-scoring-v3-verdict-v2",
      "promptVersion": "nomad-scoring-v3-prompt-v2",
      "provider": "openrouter:OpenAI",
      "model": "openai/gpt-5.6-luna",
      "responseId": "gen-1788627336-8qC2ANmelP3KtUa9XLJf",
      "aiUsed": true,
      "recoveredFromHold": false,
      "contentReceipt": {
        "schemaVersion": "nomad-scoring-v3-content-receipt-v1",
        "actorBuild": null,
        "normalizedRecordChars": 7915,
        "normalizedRecordSha256": "a514532832004a68b2977e42edd1eaa949f98f0285cf6e12f6fd3be9c53e8533",
        "descriptionChars": 5991,
        "descriptionSha256": "b5b532beeb209c2b143aec441f7eef8fbeb914951117268ec36df3f5005e897f",
        "descriptionComplete": true,
        "htmlAvailable": false,